depa_nombre,muni_nombre,codigo_habilitacion,nombre_prestador,tido_codigo,nits_nit,razon_social,clpr_codigo,clpr_nombre,ese,direccion,telefono,fax,email,gerente,nivel,caracter,habilitado,fecha_radicacion,fecha_vencimiento,fecha_cierre,dv,clase_persona,naju_codigo,naju_nombre,numero_sede_principal,fecha_corte_REPS
Bolívar,CARTAGENA,"1,300,102,220",lucila teresa florez de arco,,"45,496,558",lucila teresa florez de arco,2,Profesional Independiente,,"calle 36# 2-36 , centro . Centro de especialistas Santo Domingo, Cons 16",3135738829- 3106929865,,lucilateresa@hotmail.com,,,,SI,"20,100,513","20,210,831",,0,NATURAL,1,Privada,1,Fecha corte REPS: Mar 15 2021 1:16PM
Bolívar,CARTAGENA,"1,300,100,469",LUCY VIAÑA GONZALEZ,,"45,513,929",LUCY VIAÑA GONZALEZ,2,Profesional Independiente,,CALLE 30 No. 38-06 CENTRO MEDICO MARIA AUXILIADORA LOCAL 105,6622311,,lucyviago@hotmail.com,,,,SI,"20,110,826","20,210,831",,0,NATURAL,1,Privada,1,Fecha corte REPS: Mar 15 2021 1:16PM
Bolívar,CARTAGENA,"1,300,101,976",LUCY MARGARITA CORRALES JULIO,,"45,509,645",LUCY MARGARITA CORRALES JULIO,2,Profesional Independiente,NO,CENTRO MEDICO STA LUCIA KRA 71 # 31-297 CONS. 507,6611614-3163126184,,lucymargaritac@hotmail.com,,,,SI,"20,080,331","20,210,831",,,NATURAL,1,Privada,1,Fecha corte REPS: Mar 15 2021 1:16PM
Bolívar,CARTAGENA,"1,300,103,302",LUIS HERNAN VELASQUEZ BARRIOS,,"3,811,502",LUIS HERNAN VELASQUEZ BARRIOS,2,Profesional Independiente,,CENTRO MEDICO SANTA LUCIA CRA 71 No 35-297,6634095,"6,634,095",udhdelcaribe@gmail.com,,,,SI,"20,201,014","20,241,013",,,NATURAL,1,Privada,1,Fecha corte REPS: Mar 15 2021 1:16PM
Bolívar,CARTAGENA,"1,300,103,035",LUIS RAMON PADILLA PESTANA,,"9,092,076",LUIS RAMON PADILLA PESTANA,2,Profesional Independiente,,LOS CORALES MZA K LOTE 1,6661225,,serviciosmedicosdelcaribesas@gmail.com,,,,SI,"20,180,215","20,220,214",,,NATURAL,1,Privada,1,Fecha corte REPS: Mar 15 2021 1:16PM
Bolívar,CARTAGENA,"1,300,100,680",LUIS ABIGAIL ALZAMORA TABORDA,,"9,080,577",LUIS ABIGAIL ALZAMORA TABORDA,2,Profesional Independiente,NO,CENTRO MEDICO STO DOMINGO CL GASTELBONDO LC 13,6644016,"6,644,016",luisalzamora33@hotmail.com,,,,SI,"20,061,117","20,210,831",,2,NATURAL,1,Privada,1,Fecha corte REPS: Mar 15 2021 1:16PM
Bolívar,CARTAGENA,"1,300,101,903",LUIS ALBERTO PEREZ GUZMAN,,"7,920,744",LUIS ALBERTO PEREZ GUZMAN,2,Profesional Independiente,,CENTRO COMERCIAL RONDA REAL OF. 205,6635024,,luisperez78@hotmail.com,,,,SI,"20,120,420","20,210,831",,0,NATURAL,1,Privada,1,Fecha corte REPS: Mar 15 2021 1:16PM
Bolívar,CARTAGENA,"1,300,102,942",LUIS ALEJANDRO DIAZ ROSALES,,"1,047,371,773",LUIS ALEJANDRO DIAZ ROSALES,2,Profesional Independiente,,CALLE 6A #3-17 OFICINA 407,6662620,,luisdiaz48@gmail.com,,,,SI,"20,170,503","20,210,831",,0,NATURAL,1,Privada,1,Fecha corte REPS: Mar 15 2021 1:16PM
Bolívar,CARTAGENA,"1,300,101,964",LUIS CARLOS JULIO NARVAEZ,,"73,144,305",LUIS CARLOS JULIO NARVAEZ,2,Profesional Independiente,,-Cra. 71 No. 31-395,6933393 EXTENSION 108,,ljulionarvaez@gmail.com,,,,SI,"20,151,130","20,210,831",,7,NATURAL,1,Privada,1,Fecha corte REPS: Mar 15 2021 1:16PM
Bolívar,CARTAGENA,"1,300,103,273",LUIS DARIO BERNAL FORTICH,,"1,047,393,262",LUIS DARIO BERNAL FORTICH,2,Profesional Independiente,,Carrera 2 N° 8-16 LC 217,3004027529 - 3017972126,,bernalforticthortopedia@gmail.com,,,,SI,"20,200,406","20,240,405",,,NATURAL,1,Privada,1,Fecha corte REPS: Mar 15 2021 1:16PM
Bolívar,CARTAGENA,"1,300,102,373",LUIS ENRIQUE STAVE TAPIA,,"7,931,721",LUIS ENRIQUE STAVE TAPIA,2,Profesional Independiente,,EDIFICIO SEGUROS BOLIVAR -LOCAL 13,6651311,,luisstave@hotmail.com,,,,SI,"20,111,205","20,210,831",,0,NATURAL,1,Privada,1,Fecha corte REPS: Mar 15 2021 1:16PM
Bolívar,CARTAGENA,"1,300,101,646",LUIS FERNANDO VIAÑA GONZALEZ,,"73,133,886",LUIS FERNANDO VIAÑA GONZALEZ,2,Profesional Independiente,NO,BRR BOCAGRANDE KR 3 No. 8-06 EDF. MONTELIBANO CS 401,6550300,"6,550,149",luisfviago@yahoo.com,,,,SI,"20,061,211","20,210,831",,,NATURAL,1,Privada,1,Fecha corte REPS: Mar 15 2021 1:16PM
Bolívar,CARTAGENA,"1,300,100,759",LUIS JAVIER ALZAMORA TABORDA,,"73,082,409",LUIS JAVIER ALZAMORA TABORDA,2,Profesional Independiente,,CENTRO MEDICO SANTO DOMINGO CL GASTELBONDO LC 13,6644016,,jalzamora16@hotmail.com,,,,SI,"20,111,213","20,210,831",,0,NATURAL,1,Privada,1,Fecha corte REPS: Mar 15 2021 1:16PM
Bolívar,CARTAGENA,"1,300,100,370",LUIS MANUEL POLO VERBEL,,"9,040,038",LUIS MANUEL POLO VERBEL,2,Profesional Independiente,,CENTRO MEDICO SANTA LUCIA CONS. 403,6634540-6611613,"6,634,540",norapolov@yahoo.com,,,,SI,"20,070,115","20,210,831",,0,NATURAL,1,Privada,1,Fecha corte REPS: Mar 15 2021 1:16PM
Bolívar,CARTAGENA,"1,300,102,459",LUIS MIGUEL AYALA COGOLLO,,"73,154,965",LUIS MIGUEL AYALA COGOLLO,2,Profesional Independiente,,CENTRO MEDICO STA LUCIA CONS # 410 CRA 71 N° 31-297,3017514648,,layala323@hotmail.com,,,,SI,"20,161,221","20,210,831",,0,NATURAL,1,Privada,1,Fecha corte REPS: Mar 15 2021 1:16PM
Bolívar,CARTAGENA,"1,300,100,063",Luis Miguel Covo Segrera,,"73,124,611",Luis Miguel Covo Segrera,2,Profesional Independiente,NO,CASTILLOGRANDE CENTRO MEDICO BOCAGRANDE LC 1,6650410,"6,650,410",drluiscovo@yahoo.com,,,,SI,"20,070,223","20,210,831",,9,NATURAL,1,Privada,1,Fecha corte REPS: Mar 15 2021 1:16PM
Bolívar,CARTAGENA,"1,300,100,594",LUIS MIGUEL MORALES VILLA,,"73,137,938",LUIS MIGUEL MORALES VILLA,2,Profesional Independiente,NO,BOCARANDE CRA 3 NO. 8-129 OFICINA 503,6655388,,SOIMORALES@HOTMAIL.COM,,,,SI,"20,080,725","20,210,831",,,NATURAL,1,Privada,1,Fecha corte REPS: Mar 15 2021 1:16PM
Bolívar,CARTAGENA,"1,300,101,284",LUIS RAMON MORENO BALLESTEROS,,"6,857,331",LUIS RAMON MORENO BALLESTEROS,2,Profesional Independiente,NO,CASTILLOGRANDE CL 5 6-A 19 CENTRO MEDICO BOCAGRANDE,6656440,"6,656,440",,,,,SI,"20,061,121","20,210,831",,3,NATURAL,1,Privada,1,Fecha corte REPS: Mar 15 2021 1:16PM
Bolívar,CARTAGENA,"1,300,102,824",luis ramon padilla lara,,"80,222,972",luis ramon padilla lara,2,Profesional Independiente,,via mamanal km 1 kra 56 n 7c-39,6937775,,medico.co2@cimpre.com,,,,SI,"20,160,308","20,210,831",,0,NATURAL,1,Privada,1,Fecha corte REPS: Mar 15 2021 1:16PM
Bolívar,CARTAGENA,"1,300,102,833",LUISA FERNANDA BARRIGA PERIÑAN,,"1,047,436,799",LUISA FERNANDA BARRIGA PERIÑAN,2,Profesional Independiente,,Club de Leones Cartagena de Indias-calle 31 numero 18 B 64,6450229,,clubdeleonescartagenadeindiasmonarca@hotmail.com,,,,SI,"20,160,413","20,210,831",,0,NATURAL,1,Privada,1,Fecha corte REPS: Mar 15 2021 1:16PM
Bolívar,CARTAGENA,"1,300,102,887",LUISA FERNANDA DIAZ CORREA,,"52,057,542",LUISA FERNANDA DIAZ CORREA,2,Profesional Independiente,,BOCAGRANDE CRA 6 No. 5 -161 Consultorio 607 Centro Medico Prisma,3203109479,,fernanda80@hotmail.com,,,,SI,"20,160,901","20,210,831",,0,NATURAL,1,Privada,1,Fecha corte REPS: Mar 15 2021 1:16PM
Bolívar,CARTAGENA,"1,300,103,077",LUISA FERNANDA DUARTE GARZON,,"39,672,182",LUISA FERNANDA DUARTE GARZON,2,Profesional Independiente,,Plaza Comercial Las Ramblas KM 10 Vial al Mar,3205748131,,luferdu@hotmail.com,,,,SI,"20,180,615","20,220,614",,,NATURAL,1,Privada,1,Fecha corte REPS: Mar 15 2021 1:16PM
Bolívar,CARTAGENA,"1,300,103,223",LUTTERH LEONEL LARIOS CARDOZA,,"73,135,097",LUTTERH LEONEL LARIOS CARDOZA,2,Profesional Independiente,,Avenida pedro heredia barrio escallon villa centro medico los ejecutivos piso 2 Consultorio 227,3157353873,,lutterhlarioscardoza@gmail.com,,,,SI,"20,190,916","20,230,915",,,NATURAL,1,Privada,1,Fecha corte REPS: Mar 15 2021 1:16PM
Bolívar,CARTAGENA,"1,300,102,851",LUX ESTELLA ROJAS PALOMO,,"45,755,545",LUX ESTELLA ROJAS PALOMO,2,Profesional Independiente,,BARRIO JUNIN CALLE PRIMERO DE MAYO MANZANA K LOTE 1,6622866 - 3215246896,,luzrojaspalomo@hotmail.com,,,,SI,"20,160,516","20,210,831",,6,NATURAL,1,Privada,1,Fecha corte REPS: Mar 15 2021 1:16PM
Bolívar,CARTAGENA,"1,300,103,297",LUZ ALMA OSORIO MARTINEZ,,"45,511,520",LUZ ALMA OSORIO MARTINEZ,2,Profesional Independiente,,CALLE 31 # 91 80,3145500930,,luzalmaosorio@gmail.com,,,,SI,"20,200,928","20,240,927",,,NATURAL,1,Privada,1,Fecha corte REPS: Mar 15 2021 1:16PM
Bolívar,CARTAGENA,"1,300,100,614",LUZ KARINE DE LA CRUZ PADILLA,,"45,517,658",LUZ KARINE DE LA CRUZ PADILLA,2,Profesional Independiente,NO,CENTRO MEDICO LOS EJECUTIVOS L 106 PISO 1,6710673,"6,710,673",luzkaridp@hotmail.com,DE LA CRUZ PADILLA LUZ KARINE,,,SI,"20,060,811","20,210,831",,,NATURAL,1,Privada,1,Fecha corte REPS: Mar 15 2021 1:16PM
Bolívar,CARTAGENA,"1,300,100,917",LUZ MAYDA LUNA RICARDO,,"30,561,364",LUZ MAYDA LUNA RICARDO,2,Profesional Independiente,,Pie de la Popa Cra. 21 No 29B-15- Edificio Santorini Local 101,3008036857,,luzmaydalunar@yahoo.com,,,,SI,"20,150,812","20,210,831",,0,NATURAL,1,Privada,1,Fecha corte REPS: Mar 15 2021 1:16PM
Bolívar,CARTAGENA,"1,300,103,166",LUZ STELLA JIMENEZ DE RUIZ,,"38,225,006",LUZ STELLA JIMENEZ DE RUIZ,2,Profesional Independiente,,CARRERA 68 #31A-89,6642372,,slrjlabso@gmail.com,,,,SI,"20,190,227","20,230,226",,,NATURAL,1,Privada,1,Fecha corte REPS: Mar 15 2021 1:16PM
Bolívar,CARTAGENA,"1,300,101,096",Mabel Cecilia QUIROZ Mariano,,"45,453,545",Mabel Cecilia QUIROZ Mariano,2,Profesional Independiente,,Centro Medico Santa Lucia Consultorio 510,6612658,,mabelcquiroz@hotmail.com,,,,SI,"20,150,825","20,210,831",,0,NATURAL,1,Privada,1,Fecha corte REPS: Mar 15 2021 1:16PM
Bolívar,CARTAGENA,"1,300,103,104",Magda Carolina Puerta Lara,,"52,834,357",Magda Carolina Puerta Lara,2,Profesional Independiente,,Calle 6ª # 3-17 Oficina 703 Edificio Jasban,3108741408 - 3107072522,,puertamagda@gmail.com,,,,SI,"20,180,808","20,220,807",,,NATURAL,1,Privada,1,Fecha corte REPS: Mar 15 2021 1:16PM
Bolívar,CARTAGENA,"1,300,101,155",MAIRA DEL ROSARIO BARRIOS POSSO,,"45,463,870",MAIRA DEL ROSARIO BARRIOS POSSO,2,Profesional Independiente,,CENTRO COMERCIAL SAN FERNANDO PISO 1 LOCAL 120,3114083988 - 3012438614,,opticayglasses@gmail.com,MAIRA DEL CARMEN BARRIOS POSSO,,,SI,"20,171,030","20,210,831",,1,NATURAL,1,Privada,1,Fecha corte REPS: Mar 15 2021 1:16PM
Bolívar,CARTAGENA,"1,300,102,071",MANELA GARCIA VASQUEZ,,"45,691,049",MANELA GARCIA VASQUEZ,2,Profesional Independiente,NO,BOCAGRANDE CRA 6A # 5-161 CENTRO MEDICO PRISMA,321 6374291,"3,168,955,958",msgva@hotmail.com,,,,SI,"20,090,127","20,210,831",,,NATURAL,1,Privada,1,Fecha corte REPS: Mar 15 2021 1:16PM
Bolívar,CARTAGENA,"1,300,103,229",MANUEL ANDRADE GARCIA,,"8,680,775",MANUEL ANDRADE GARCIA,2,Profesional Independiente,,cra 71 No. 31-297 consultorio 307,3133958729,,unidadmedicaalternativa@hotmail.com,,,,SI,"20,190,925","20,230,924",,5,NATURAL,1,Privada,1,Fecha corte REPS: Mar 15 2021 1:16PM
Bolívar,CARTAGENA,"1,300,102,976",MANUEL ALEJANDRO LUNA LUNA,,"73,183,402",MANUEL ALEJANDRO LUNA LUNA,2,Profesional Independiente,,Cra 71 No 31-297 CENTRO MEDICO SANTA LUCIA CONSULTORIO 210,6661254 - 3106578039,,lunamanuel@hotmail.com,,,,SI,"20,170,824","20,210,831",,0,NATURAL,1,Privada,1,Fecha corte REPS: Mar 15 2021 1:16PM
Bolívar,CARTAGENA,"1,300,100,157",Manuel Genaro Marrugo Grice,,"9,093,112",Manuel Genaro Marrugo Grice,2,Profesional Independiente,,calle 5 -Centro medico bocagrande consultorio 204 Piso 2,3003444632-3008108112,,m.marrugo@hotmail.com,,,,SI,"20,150,421","20,210,831",,0,NATURAL,1,Privada,1,Fecha corte REPS: Mar 15 2021 1:16PM
Bolívar,CARTAGENA,"1,300,102,607",MANUEL JOSE MARTINEZ OROZCO,,"73,098,077",MANUEL JOSE MARTINEZ OROZCO,2,Profesional Independiente,,CRA 50 No 31B25,3135250407 - 6465845,,manueljosemartinez@hotmail.com,,,,SI,"20,140,114","20,210,831",,0,NATURAL,1,Privada,1,Fecha corte REPS: Mar 15 2021 1:16PM
Bolívar,CARTAGENA,"1,300,100,282",MANUELA DEL CARMEN LICERO DEL RISCO,,"33,141,189",MANUELA DEL CARMEN LICERO DEL RISCO,2,Profesional Independiente,,CENTRO EDIFICIO CITIBANK OFICINA 5H AV VENEZUELA,3163100605,,liceror-mane@hotmail.com,,,,SI,"20,190,524","20,210,831",,8,NATURAL,1,Privada,1,Fecha corte REPS: Mar 15 2021 1:16PM
Bolívar,CARTAGENA,"1,300,100,677",MANUELA ELENA BERROCAL REVUELTAS,,"34,965,611",MANUELA ELENA BERROCAL REVUELTAS,2,Profesional Independiente,,CENTRO MEDICO BOCAGRANDE PISO 1 CONSULTORIO 3,6657192,,manebe@une.net.co,,,,SI,"20,110,908","20,210,831",,0,NATURAL,1,Privada,1,Fecha corte REPS: Mar 15 2021 1:16PM
Bolívar,CARTAGENA,"1,300,102,927",Marcel franco Elles,,"73,078,094",Marcel franco Elles,2,Profesional Independiente,,Manzana D Lote 8 Consultorio 1,6616717 . 3114067294,,mfranco59025@gmail.com,,,,SI,"20,170,404","20,210,831",,0,NATURAL,1,Privada,1,Fecha corte REPS: Mar 15 2021 1:16PM
Bolívar,CARTAGENA,"1,300,102,359",MARCELIANO BALLESTAS HERRERA,,"73,080,678",MARCELIANO BALLESTAS HERRERA,2,Profesional Independiente,,Carrera 38 No. 29-68,6621835,,casasalud@hotmail.com,,,,SI,"20,111,027","20,210,831",,0,NATURAL,1,Privada,1,Fecha corte REPS: Mar 15 2021 1:16PM
Bolívar,CARTAGENA,"1,300,101,979",Marco Antonio Araujo Orozco,,"73,579,967",Marco Antonio Araujo Orozco,2,Profesional Independiente,,"Bocagrande, Calle 6 # 3-17 Edificio Jasban Consultorio 407",3124545416,,ortomaraujo77@yahoo.com,,,,SI,"20,160,707","20,210,831",,0,NATURAL,1,Privada,1,Fecha corte REPS: Mar 15 2021 1:16PM
Bolívar,CARTAGENA,"1,300,102,563",MARCOS TULIO SALAS DE LA HOZ,,"73,159,248",MARCOS TULIO SALAS DE LA HOZ,2,Profesional Independiente,,Providencia Cr71 31-297 Centro Medico Santa Lucia Con 310,6611614-3135117192,,marcostulio67@hotmail.com,,,,SI,"20,130,702","20,210,831",,0,NATURAL,1,Privada,1,Fecha corte REPS: Mar 15 2021 1:16PM
Bolívar,CARTAGENA,"1,300,103,136",Margarita Ardila Berdugo,,"1,047,375,104",Margarita Ardila Berdugo,2,Profesional Independiente,,CARRERA 81 22D-253 BLOQUE 2 LOCAL 6,3103564580- 3013256320,,gardiaesthetic@gmail.com,,,,SI,"20,181,030","20,221,029",,,NATURAL,1,Privada,1,Fecha corte REPS: Mar 15 2021 1:16PM
Bolívar,CARTAGENA,"1,300,102,233",MARGARITA URREGO CARO,,"45,480,591",margarita irene urrego caro,2,Profesional Independiente,,CENTRO MEDICO SANTA ISABEL LOCAL 102,3003160555,,maiuca15@hotmail.com,,,,SI,"20,180,125","20,210,831",,0,NATURAL,1,Privada,1,Fecha corte REPS: Mar 15 2021 1:16PM
Bolívar,CARTAGENA,"1,300,102,973",MARGARITA LUCIA CHAVEZ SEVERICHE,,"32,905,745",MARGARITA LUCIA CHAVEZ SEVERICHE,2,Profesional Independiente,,BOCAGRANDE CRA 2 No. 8-250,6657258,,maluchase@hotmail.com,,,,SI,"20,170,822","20,210,831",,0,NATURAL,1,Privada,1,Fecha corte REPS: Mar 15 2021 1:16PM
Bolívar,CARTAGENA,"1,300,102,587",MARGARITA SUSANA GARCIA MELENDEZ,,"45,521,552",MARGARITA SUSANA GARCIA MELENDEZ,2,Profesional Independiente,,Cetro Medico Bocagrande Cl 5 6 A-19,300-6673629,,mgarciamelendez@gmail.com,,,,SI,"20,130,926","20,210,831",,1,NATURAL,1,Privada,1,Fecha corte REPS: Mar 15 2021 1:16PM
Bolívar,CARTAGENA,"1,300,103,173",MARIA CAROLINA RIPOLL BENAVIDEZ,,"45,525,126",MARIA CAROLINA RIPOLL BENAVIDEZ,2,Profesional Independiente,,TRASVERSAL 35 29-200 CENTRO MEDICO CRECER CONST 2,3104201552-3126446839,,mcaritor@hotmail.com,,,,SI,"20,190,315","20,230,314",,,NATURAL,1,Privada,1,Fecha corte REPS: Mar 15 2021 1:16PM
Bolívar,CARTAGENA,"1,300,100,160",MARIA DEL PILAR MARQUEZ FACIOLINCE,,"45,448,446",MARIA DEL PILAR MARQUEZ FACIOLINCE,2,Profesional Independiente,,BOCAGRANDE CRA 6ta No. 5-161 CONS 501 CENTRO MEDICO PRISMA,6658104,,neofpediatriasas@gmail.com,,,,SI,"20,190,215","20,210,831",,9,NATURAL,1,Privada,1,Fecha corte REPS: Mar 15 2021 1:16PM
Bolívar,CARTAGENA,"1,300,103,274",MARIA DEL SOCORRO PEREIRA AMADOR,,"1,047,471,800",MARIA DEL SOCORRO PEREIRA AMADOR,2,Profesional Independiente,,CABRERO CARRERA 2 ·43-102 EDIFICIO NAPOLI APTO 1102,3145508040,,mary_pereira94@hotmail.com,,,,SI,"20,200,528","20,240,527",,,NATURAL,1,Privada,1,Fecha corte REPS: Mar 15 2021 1:16PM
Bolívar,CARTAGENA,"1,300,101,499",maria fernanda lengua orjuela,,"51,882,986",maria fernanda lengua orjuela,2,Profesional Independiente,,calle 5 # 4 -10 consultorio 103,6653446,,mflengua@hotmail.com,,,,SI,"20,150,727","20,210,831",,0,NATURAL,1,Privada,1,Fecha corte REPS: Mar 15 2021 1:16PM
Bolívar,CARTAGENA,"1,300,102,360",MARÍA ALEJANDRA APARICIO REINO,,"45,541,719",maria alejandra aparicio reino,2,Profesional Independiente,,"AVENIDA PEDRO DE HEREDIA, Mz. C Lote 33",3135973833,,labmariaaparicio@gmail.com,,,,SI,"20,200,625","20,210,831",,0,NATURAL,1,Privada,1,Fecha corte REPS: Mar 15 2021 1:16PM
Bolívar,CARTAGENA,"1,300,103,152",Maria Camila Bustillo Prado,,"1,047,435,200",Maria Camila Bustillo Prado,2,Profesional Independiente,,crr 22 #28-88,3002884431,,mcamilabp@hotmail.com,,,,SI,"20,190,110","20,230,109",,,NATURAL,1,Privada,1,Fecha corte REPS: Mar 15 2021 1:16PM
Bolívar,CARTAGENA,"1,300,103,121",MARIA CAMILA PUERTA SOTO,,"1,047,443,678",MARIA CAMILA PUERTA SOTO,2,Profesional Independiente,,PLAZA COMERCIAL LAS RAMBLAS LOCAL 606 KM 9 ANILLO VIAL,3114188170,,mpuertasoto@gmail.com,,,,SI,"20,180,918","20,220,917",,,NATURAL,1,Privada,1,Fecha corte REPS: Mar 15 2021 1:16PM
Bolívar,CARTAGENA,"1,300,103,081",María Camila Valencia Zamora,,"1,143,352,098",María Camila Valencia Zamora,2,Profesional Independiente,,Manga Calle 26 N° 17-179,3002955300,,marivalencia9105@gmail.com,,,,SI,"20,180,620","20,220,619",,,NATURAL,1,Privada,1,Fecha corte REPS: Mar 15 2021 1:16PM
Bolívar,CARTAGENA,"1,300,102,997",MARIA CAROLINA MENDOZA RAMIREZ,,"1,047,441,018",MARIA CAROLINA MENDOZA RAMIREZ,2,Profesional Independiente,,"CENTRO EDIF CONCASA, LA MATUNA CL 32- 8A-50 CONS. 1506",3043750564,,caromendoza12@hotmail.com,,,,SI,"20,171,031","20,211,030",,0,NATURAL,1,Privada,1,Fecha corte REPS: Mar 15 2021 1:16PM
Bolívar,CARTAGENA,"1,300,100,473",MARIA CECILIA ORTEGA FONTALVO,,"26,689,702",MARIA CECILIA ORTEGA FONTALVO,2,Profesional Independiente,,"Centro Médico Los Ejecutivos, consultorio 209.",6613480- 3008038525.,,mariacecilia-o@hotmail.com,,,,SI,"20,160,203","20,210,831",,0,NATURAL,1,Privada,1,Fecha corte REPS: Mar 15 2021 1:16PM
Bolívar,CARTAGENA,"1,300,101,989",MARIA CLAUDIA BLANCO NAVARRO,,"22,805,535",MARIA CLAUDIA BLANCO NAVARRO,2,Profesional Independiente,NO,BOCAGRANDE CALLE 5 #6-151 2do PISO,6657283,,MCBLANCO5@HOTMAIL.COM,,,,SI,"20,080,507","20,210,831",,,NATURAL,1,Privada,1,Fecha corte REPS: Mar 15 2021 1:16PM
Bolívar,CARTAGENA,"1,300,102,110",MARIA CLAUDIA BURGOS BANQUEZ,,"30,764,431",MARIA CLAUDIA BURGOS BANQUEZ,2,Profesional Independiente,NO,Kr 71 Nº 31-297 Cons 205 C.M Santa Lucia,6613349,"6,613,349",marieburgos@yahoo.com,,,,SI,"20,090,521","20,210,831",,,NATURAL,1,Privada,1,Fecha corte REPS: Mar 15 2021 1:16PM
Bolívar,CARTAGENA,"1,300,102,962",María Cristina Mejía Quiroga,,"1,050,954,359",María Cristina Mejía Quiroga,2,Profesional Independiente,,Cra. 4 No. 6-142,3046683194,,mcmejiaquiroga@outllook.es,,,,SI,"20,170,704","20,210,831",,0,NATURAL,1,Privada,1,Fecha corte REPS: Mar 15 2021 1:16PM
Bolívar,CARTAGENA,"1,300,102,639",MARIA CRISTINA RUIZ NORIEGA,,"22,790,772",MARIA CRISTINA RUIZ NORIEGA,2,Profesional Independiente,,calle 32A8A-50 edificio concasa,6464162,,salud_dental_colombia@outlook.com,,,,SI,"20,140,521","20,210,831",,0,NATURAL,1,Privada,1,Fecha corte REPS: Mar 15 2021 1:16PM
Bolívar,CARTAGENA,"1,300,102,334",MARIA DEL PILAR LUJAN PARDO,,"45,544,389",MARIA DEL PILAR LUJAN PARDO,2,Profesional Independiente,,"Carrera 1 No 11-28 Edificio Pedro de Heredia Locales 1,2,3",6653064,"6,653,064",pilarlujan@gmail.com,,,,SI,"20,150,602","20,210,831",,0,NATURAL,1,Privada,1,Fecha corte REPS: Mar 15 2021 1:16PM
Bolívar,CARTAGENA,"1,300,103,135",Maria Elena Restrepo Puello,,"1,047,448,709",Maria Elena Restrepo Puello,2,Profesional Independiente,,Bocagrande Calle 6 a #3-17 Edificio jasban Oficina 506,3205689622,,mariaelenarepu@gmail.com,,,,SI,"20,181,024","20,221,023",,,NATURAL,1,Privada,1,Fecha corte REPS: Mar 15 2021 1:16PM
Bolívar,CARTAGENA,"1,300,100,299",maria erika sanchez rodriguez,,"33,449,438",MARIA ERIKA SANCHEZ RODRIGUEZ,2,Profesional Independiente,,Cra 70 No. 224,6437120 - 6437731 - 301 7864880,,navyuniformcol@yahoo.es,,,,SI,"20,191,017","20,210,831",,0,NATURAL,1,Privada,1,Fecha corte REPS: Mar 15 2021 1:16PM
Bolívar,CARTAGENA,"1,300,101,788",MARIA EUGENIA MARTINEZ CASATTI,,"45,452,248",MARIA EUGENIA MARTINEZ CASATTI,2,Profesional Independiente,NO,BOCAGRANDE CRA 6 No. 5-161 CENTRO MEDICO PRISMA,6656425,"6,656,425",mayuma@hotmail.com,,,,SI,"20,060,818","20,210,831",,,NATURAL,1,Privada,1,Fecha corte REPS: Mar 15 2021 1:16PM
Bolívar,CARTAGENA,"1,300,103,222",MARIA EUGENIA SIMANCAS URANGO,,"1,126,239,975",MARIA EUGENIA SIMANCAS URANGO,2,Profesional Independiente,,BLZDELEZO MAZANA 2 LOTE 27 AP 102,3147047620 - 3058731727,,juanc.24@hotmail.com,,,,SI,"20,190,916","20,230,915",,1,NATURAL,1,Privada,1,Fecha corte REPS: Mar 15 2021 1:16PM
Bolívar,CARTAGENA,"1,300,103,296",MARIA FERNANDA GUARDO MARTINEZ,,"1,044,922,264",MARIA FERNANDA GUARDO MARTINEZ,2,Profesional Independiente,,Edificio zamary 2do piso diag 31 #71-145,3135995537,,mafe_7_17@hotmail.com,,,,SI,"20,200,925","20,240,924",,,NATURAL,1,Privada,1,Fecha corte REPS: Mar 15 2021 1:16PM
Bolívar,CARTAGENA,"1,300,100,345",MARIA G. ROYO,,"45,462,427",MARIA G. ROYO,2,Profesional Independiente,NO,URB STA LUCIA CR 71 35-297 P 2 CONS 207,6634742,,mariaroyocamacho@hotmail.com,,,,SI,"20,090,204","20,210,831",,,NATURAL,1,Privada,1,Fecha corte REPS: Mar 15 2021 1:16PM
Bolívar,CARTAGENA,"1,300,100,902",MARIA GRAZIA GIRONE COGLIANDOLO,,"222,540",MARIA GRAZIA GIRONE COGLIANDOLO,2,Profesional Independiente,,CENTRO DE ESPECIALISTAS SANTO DOMINGO CALLE GASTELBONDO No 2-36 OF No 4,6642358,"6,642,358",mariagrazia.girone@gmail.com,,,,SI,"20,080,721","20,210,831",,,NATURAL,1,Privada,1,Fecha corte REPS: Mar 15 2021 1:16PM
Bolívar,CARTAGENA,"1,300,103,193",MARIA ISABEL ALVAREZ CHICA,,"39,191,550",MARIA ISABEL ALVAREZ CHICA,2,Profesional Independiente,,"BOCAGRANDE, CALLE 6A No 03-32",3157455611,,mariai_alvarez@yahoo.es,,,,SI,"20,190,604","20,230,603",,,NATURAL,1,Privada,1,Fecha corte REPS: Mar 15 2021 1:16PM
Bolívar,CARTAGENA,"1,300,103,030",MARIA jOSE Agresott Romero,,"1,143,331,150",MARIA jOSE Agresott Romero,2,Profesional Independiente,,CITYBANK 4 PISO OFICINA 4GH,3235926923,,majomajoagresott25@gmail.com,,,,SI,"20,180,126","20,220,125",,,NATURAL,1,Privada,1,Fecha corte REPS: Mar 15 2021 1:16PM
Bolívar,CARTAGENA,"1,300,101,880",MARIA JOSE DE LOS ANGELES GUERRERO MASS,,"30,765,676",MARIA JOSE DE LOS ANGELES GUERRERO MASS,2,Profesional Independiente,NO,MANGA TERCERA AVENIDA No 22-201 PRIMER PISO,6642611,"6,642,611",mariajoseguerreromass@gmail.com,,,,SI,"20,070,313","20,210,831",,0,NATURAL,1,Privada,1,Fecha corte REPS: Mar 15 2021 1:16PM
Bolívar,CARTAGENA,"1,300,100,742",MARIA JOSEFINA SOTO VASQUEZ,,"45,444,201",MARIA JOSEFINA SOTO VASQUEZ,2,Profesional Independiente,,CRESPO 3 AV. No. 67-90,6900608,,marjosovas@yahoo.es,,,,SI,"20,100,408","20,210,831",,0,NATURAL,1,Privada,1,Fecha corte REPS: Mar 15 2021 1:16PM
Bolívar,CARTAGENA,"1,300,100,288",MARIA JUDITH ROCA MENDOZA,,"45,448,519",MARIA JUDITH ROCA MENDOZA,2,Profesional Independiente,NO,CENTRO LA MATUNA CL32 8-39 CONS 203 COMERCIOS LA MATUNA,6600371,"6,600,371",maryrocamendoza@yahoo.com,,,,SI,"20,061,108","20,210,831",,8,NATURAL,1,Privada,1,Fecha corte REPS: Mar 15 2021 1:16PM
Bolívar,CARTAGENA,"1,300,102,504",MARIA MAGDALENA GOMEZ CORONEL,,"45,454,233",maria magdalena gomez coronel,2,Profesional Independiente,,LA CONSOLATA MZ D LOTE 8,6616717,,mariamagdalenagomez@hotmail.com,,,,SI,"20,190,321","20,210,831",,0,NATURAL,1,Privada,1,Fecha corte REPS: Mar 15 2021 1:16PM
Bolívar,CARTAGENA,"1,300,102,835",MARIA MARGARITA MOLINA BARBOZA,,"1,047,431,311",MARIA MARGARITA MOLINA BARBOZA,2,Profesional Independiente,,"CALLE DEL BOQUETE , Kra 9 N° 35-15 EDIFICIO JULIO BARBUR OFICINA 202",6437243 - 3013244698,,margaritamolinab@hotmail.com,,,,SI,"20,160,420","20,210,831",,0,NATURAL,1,Privada,1,Fecha corte REPS: Mar 15 2021 1:16PM
Bolívar,CARTAGENA,"1,300,103,079",MARIA PAULA VELEZ DIAZ,,"1,143,370,003",MARIA PAULA VELEZ DIAZ,2,Profesional Independiente,,CRA 60 No. 31.139 CENTRO DE SALUD Y NEGOCIOS RONDA REAL II - PISO 7 LOCAL 703,3504694396,,mpvelezd@gmail.com,,,,SI,"20,180,608","20,220,607",,,NATURAL,1,Privada,1,Fecha corte REPS: Mar 15 2021 1:16PM
Bolívar,CARTAGENA,"1,300,103,177",maria victoria reyes trujillo,,"1,143,354,644",maria victoria reyes trujillo,2,Profesional Independiente,,Calle 31 No 91-80 ? Zona Industrial,651 70 71,,lajuanfe@juanfe.org,,,,SI,"20,190,329","20,230,328",,,NATURAL,1,Privada,1,Fecha corte REPS: Mar 15 2021 1:16PM
Bolívar,CARTAGENA,"1,300,101,017",MARIA YOLANDA SOLANA TINOCO,,"45,465,523",MARIA YOLANDA SOLANA TINOCO,2,Profesional Independiente,,MANGA AVENIDA MIRAMAR No. 20-309 PRIMER PISO,3023893183- 6431005,,mariyosolana@gmail.com,,,,SI,"20,170,421","20,210,831",,0,NATURAL,1,Privada,1,Fecha corte REPS: Mar 15 2021 1:16PM
Bolívar,CARTAGENA,"1,300,102,981",MARIELA DEL CARMEN MONTES CORONADO,,"30,560,212",Mariela del Carmen Montes Coronado,2,Profesional Independiente,,BARRIO SANTA LUCIA CR 70 MZ I LOTE 1,6462283,,montessmith@hotmail.com,,,,SI,"20,170,925","20,210,924",,,NATURAL,1,Privada,1,Fecha corte REPS: Mar 15 2021 1:16PM
Bolívar,CARTAGENA,"1,300,103,123",MARIETTA LUZ JUAN GUERDELA,,"1,001,803,393",MARIETTA LUZ JUAN GUERDELA,2,Profesional Independiente,,BOCAGRANDE CALLE 5 # 6A-19 CENTRO MEDICO BOCAGRANDE 2 PISO CONSULTORIO 202,6709033,,marietajuan@hotmail.com,,,,SI,"20,180,925","20,220,924",,,NATURAL,1,Privada,1,Fecha corte REPS: Mar 15 2021 1:16PM
Bolívar,CARTAGENA,"1,300,102,930",MARIO ANDRES SANTOYA PERA,,"73,190,888",MARIO ANDRES SANTOYA PERA,2,Profesional Independiente,,CRR 44C # 29-114 - CONS 403,6745111,,mario-santoya@hotmail.com,,,,SI,"20,170,419","20,210,831",,0,NATURAL,1,Privada,1,Fecha corte REPS: Mar 15 2021 1:16PM
Bolívar,CARTAGENA,"1,300,100,389",MARIO DE JESUS DIAZ OLIER,,"9,083,120",MARIO DE JESUS DIAZ OLIER,2,Profesional Independiente,NO,ESCALLON VILLA CLL 31 No. 58-38 CENTRO MEDICO LOS EJECUTIVOS CONSULTORIO 306,6614241,,diazolier@hotmail.com,,,,SI,"20,090,105","20,210,831",,,NATURAL,1,Privada,1,Fecha corte REPS: Mar 15 2021 1:16PM
