depa_nombre,muni_nombre,codigo_habilitacion,nombre_prestador,tido_codigo,nits_nit,razon_social,clpr_codigo,clpr_nombre,ese,direccion,telefono,fax,email,gerente,nivel,caracter,habilitado,fecha_radicacion,fecha_vencimiento,fecha_cierre,dv,clase_persona,naju_codigo,naju_nombre,numero_sede_principal,fecha_corte_REPS
Bolívar,EL CARMEN DE BOLÍVAR,"1,324,400,873",FUNDACION PARA LA PROMOCION DE LA SALUD Y PREVENCION DE LA ENFERMEDAD RENAL - PREVRENAL,,"805,031,507",FUNDACION PARA LA PROMOCION DE LA SALUD Y PREVENCION DE LA ENFERMEDAD RENAL,1,Instituciones - IPS,,CALLE 27#40 ESQUINA,3155511341,,gerencia@prevrenal.co,Carlos Hernan Mejia García,,,SI,"20,190,402","20,230,401",,5,JURIDICO,1,Privada,1,Fecha corte REPS: Mar 15 2021 1:16PM
Bolívar,EL CARMEN DE BOLÍVAR,"1,324,400,693",IPS FUNDACION SERSOCIAL SEDE CARTAGENA,,"900,422,757",IPS FUNDACION SERSOCIAL SEDE CARTAGENA,1,Instituciones - IPS,,Calle 23 No. 56 32 BR MONTECARMELO,3205415096,,mjerez@sersocial.org,MARLY PATRICIA JEREZ ARIAS,,,SI,"20,161,213","20,210,831",,2,JURIDICO,1,Privada,1,Fecha corte REPS: Mar 15 2021 1:16PM
Bolívar,EL CARMEN DE BOLÍVAR,"1,324,400,590",IPS LABORATORIO CLINICO ESPECIALIZADO CLINICOM S.A.S,,"900,336,072",IPS LABORATORIO CLINICO ESPECIALIZADO CLINICOM S.A.S,1,Instituciones - IPS,,CALLE 23 #51-16,6862499,"6,862,499",clinicomlab@yahoo.com,CARMEN CECILIA SANCHEZ BARRIOS,,,SI,"20,100,602","20,210,831",,8,JURIDICO,1,Privada,1,Fecha corte REPS: Mar 15 2021 1:16PM
Bolívar,EL CARMEN DE BOLÍVAR,"1,324,400,446",LABORATORIO CLINICO DIAGNOSIS,,"900,087,964",LABORATORIO CLINICO DIAGNOSIS,1,Instituciones - IPS,,KRA 48 NO 25-15,3008388782 - 3004412224 - 3004493743,,danieldonadorueda@hotmail.com,JULIANA MARIA GONZALEZ RUEDA,,,SI,"20,160,422","20,210,831",,3,JURIDICO,1,Privada,1,Fecha corte REPS: Mar 15 2021 1:16PM
Bolívar,EL CARMEN DE BOLÍVAR,"1,324,491,964",PORTUSALUD & PREVENCION SAS,,"900,879,843",PORTUSALUD & PREVENCION SAS,1,Instituciones - IPS,,calle 25 #45-48 carmen de bolivar,6871643,"6,625,388",portusaludyprevencion@gmail.com,WILMER MENDOZA LOZANO,,,SI,"20,170,609","20,210,831",,1,JURIDICO,1,Privada,1,Fecha corte REPS: Mar 15 2021 1:16PM
Bolívar,EL CARMEN DE BOLÍVAR,"1,324,400,354",SALUD INTEGRAL DEL CARMEN I.P.S. E.U.,,"806,015,892",SALUD INTEGRAL DEL CARMEN I.P.S. E.U.,1,Instituciones - IPS,,CARRERA 50 22-137 BARRIO CENTRO,3017190755 - 3015349769,,kellypacheco01@hotmail.com,KELLY CONCEPCION PACHECO RIVERA,,,SI,"20,190,508","20,210,831",,2,JURIDICO,1,Privada,1,Fecha corte REPS: Mar 15 2021 1:16PM
Bolívar,EL CARMEN DE BOLÍVAR,"1,324,400,780",Vital Medical Center SAS,,"900,757,296",IPS VITAL MEDICAL CENTER,1,Instituciones - IPS,,calle 24 No 44 73 brr Santander,6862313 3041177855,,ipsvitalmedicalcenter1@gmail.com,OSCAR ANDRES ROMANI MEJIA,,,SI,"20,181,221","20,210,831",,7,JURIDICO,1,Privada,1,Fecha corte REPS: Mar 15 2021 1:16PM
Bolívar,EL PEÑÓN,"1,326,800,021",ESE CENTRO DE SALUD CON CAMAS EL PEÑON BOLIVAR,,"806,011,087",ESE CENTRO DE SALUD CON CAMAS EL PEÑON BOLIVAR,1,Instituciones - IPS,SI,EL PEÑON TRV 7 No 7-08 barrio las delicias,3235026110,"3,017,671,333",silviarangel354@gmail.com,SILVIA LILIANA RANGEL FUENTES,1,MUNICIPAL,SI,"20,180,510","20,210,831",,1,JURIDICO,4,Pública,1,Fecha corte REPS: Mar 15 2021 1:16PM
Bolívar,HATILLO DE LOBA,"1,330,000,551",ESE HOSPITAL HATILLO DE LOBA,,"806,013,761",ESE HOSPITAL HATILLO DE LOBA,1,Instituciones - IPS,SI,CALLE 8 CRA 6 # 6-25,3106254432 -3205413029,,esehatillodeloba@hotmail.com - gerenciaesehatillodeloba@outlook.es,LEONOR MORA BARANDICA,1,MUNICIPAL,SI,"20,071,121","20,210,831",,7,JURIDICO,4,Pública,1,Fecha corte REPS: Mar 15 2021 1:16PM
Bolívar,MAGANGUÉ,"1,343,000,990",AZUR SAS,,"901,353,169",AZUR SAS,1,Instituciones - IPS,,CALLE 17 N10A 90,3155801870,,azursas7@gmail.com,ALEXANDER ARGUMEDO CAEZ,,,SI,"20,201,204","20,241,203",,9,JURIDICO,1,Privada,1,Fecha corte REPS: Mar 15 2021 1:16PM
Bolívar,MAGANGUÉ,"1,343,000,841",CENTRO DE ESPECIALIDADES ODONTOLOGICA MAXIDENT S.A.S.,,"900,989,205",CENTRO DE ESPECIALIDADES ODONTOLOGICA MAXIDENT S.A.S.,1,Instituciones - IPS,,CALLE 16 # 8-24 BARRIO CORDOBA,3012102200 - 3007152440,,oscarrinconhernandez@hotmail.com,OSCAR JULIO RINCON HERNANDEZ,,,SI,"20,160,901","20,210,831",,2,JURIDICO,1,Privada,1,Fecha corte REPS: Mar 15 2021 1:16PM
Bolívar,MAGANGUÉ,"1,343,002,285","CENTRO DE ESTETICA DENTAL DE CARTAGENA LTDA ""CESDENT""",,"900,346,637",CENTRO DE ESTETICA DENTAL DE CARTAGENA LTDA. - CESDENT,1,Instituciones - IPS,,CALLE 16 10-201 EXITO MAGANGUE LC 122,6888126,,cesdentmagangue@hotmail.com,KAREN JULIETH REYES ARROYO,,,SI,"20,181,026","20,221,025",,1,JURIDICO,1,Privada,1,Fecha corte REPS: Mar 15 2021 1:16PM
Bolívar,MAGANGUÉ,"1,343,000,349",CENTRO DE REHABILITACION FISICA Y ESTETICA IPS SAS,,"806,015,513",CENTRO DE REHABILITACION FISICA Y ESTETICA IPS SAS,1,Instituciones - IPS,,CL 17 16 02 P1,6878220,,crefelo.ips@hotmail.com,LUCY DEL CARMEN ORDOÑEZ MENDOZA,,,SI,"20,160,217","20,210,831",,6,JURIDICO,1,Privada,1,Fecha corte REPS: Mar 15 2021 1:16PM
Bolívar,MAGANGUÉ,"1,343,010,914",CENTRO INTEGRAL DE REHABILITACIÓN EN MOVIMIENTO SAS- IPS CIREM,,"901,255,470",CENTRO INTEGRAL DE REHABILITACIÓN EN MOVIMIENTO SAS- IPS CIREM,1,Instituciones - IPS,,CL 14 18 A 16 BARRIO SAN MARTIN,3216684956,,valentina91100@hotmail.com,MILENA ALEXANDRA NAVARRO MARQUEZ,,,SI,"20,190,917","20,210,831",,1,JURIDICO,1,Privada,1,Fecha corte REPS: Mar 15 2021 1:16PM
Bolívar,MAGANGUÉ,"1,343,000,922",centro medico y fonoaudiologico para el desarrollo integral fonomedic,,"900,853,448",centro medico y fonoaudiologico para el desarrollo integral fonomedic,1,Instituciones - IPS,,cra 11 #3-86 brr centro calle los turcos,3023461074 -3005723071,"6,489,493",claragortega2009@hotmail.com,CLARA ELENA GONZALES ORTEGA,,,SI,"20,181,207","20,221,206",,0,JURIDICO,1,Privada,1,Fecha corte REPS: Mar 15 2021 1:16PM
Bolívar,MAGANGUÉ,"1,343,000,724",CONSULTORIO MEDICO ESPECIALIZADO INES TABORDA DIAZ IPS,,"900,513,381",CONSULTORIO MEDICO ESPECIALIZADO INES TABORDA DIAZ IPS,1,Instituciones - IPS,,CALLE11 # 03 - 110 P2 BARR CENTRO,6877963 - 3012180037 - 3103471826,"6,877,963",intadi2101@hotmail.com,RICARDO SALAS DIAZ,,,SI,"20,130,725","20,210,831",,8,JURIDICO,1,Privada,1,Fecha corte REPS: Mar 15 2021 1:16PM
Bolívar,MAGANGUÉ,"1,343,000,559",CORPORACION INSTITUTO DE NEURO REHABILITACION DE COLOMBIA NEUROINTEGRAL IPS,,"900,175,626",CORPORACION INSTITUTO DE NEURO REHABILITACION DE COLOMBIA NEUROINTEGRAL IPS,1,Instituciones - IPS,NO,carrera 16 N 16 11 barrio montecatini,3002056906 - 3002055375,,neurointegralips@gmail.com,TERESA DE JESUS PACHECO RANGEL,,,SI,"20,090,511","20,210,831",,6,JURIDICO,1,Privada,1,Fecha corte REPS: Mar 15 2021 1:16PM
Bolívar,MAGANGUÉ,"1,343,000,853",CORPORACION VIDA Y SALUD MAGANGUE IPS,,"900,994,767",CORPORACION VIDA Y SALUD MAGANGUE IPS,1,Instituciones - IPS,,CALLE 18 N 10B-82 BARRIO OLAYA,6888136 - 3008099748,,sandramq1215@hotmail.com,SANDRA MILENA MARTINEZ QUESADA,,,SI,"20,161,205","20,210,831",,1,JURIDICO,1,Privada,1,Fecha corte REPS: Mar 15 2021 1:16PM
Bolívar,MAGANGUÉ,"1,343,000,152",COSANMED IPS LTDA.,,"804,007,178","COMERCIALIZADORA SANTANDEREANA DE MEDICAMENTOS LIMITADA ""COSANMED LTDA""",1,Instituciones - IPS,,CARRERA 13C 16D - 40 BARRIO SAN JOSE,3167491166-3186943706,,cosanmedltdaips@hotmail.com,JORGE ARMANDO CASTRO BONILLA,,,SI,"20,181,025","20,221,024",,0,JURIDICO,1,Privada,1,Fecha corte REPS: Mar 15 2021 1:16PM
Bolívar,MAGANGUÉ,"1,343,000,950",DEALMEDIC S.A.S,,"901,384,440",DEALMEDIC S.A.S,1,Instituciones - IPS,,CL 17 A N. 9 - 110 BRR OLAYA HERRERA,3003830149,,dealmedic@gmail.com,Renny Eladio Barros Tobías,,,SI,"20,201,118","20,241,117",,3,JURIDICO,1,Privada,1,Fecha corte REPS: Mar 15 2021 1:16PM
Bolívar,MAGANGUÉ,"1,343,000,492",EMPRESA SOCIAL DEL ESTADO HOSPITAL LA DIVINA MISERICORDIA,,"900,196,347",EMPRESA SOCIAL DEL ESTADO HOSPITAL LA DIVINA MISERICORDIA,1,Instituciones - IPS,SI,Avenida Colombia Nº13-146,6888223-3017573836- 6881770,"6,888,223",esehospitaldivinamisericordia@hotmail.com,NULFA MANJARREZ SURMAY,2,DEPARTAMENTAL,SI,"20,080,116","20,210,831",,6,JURIDICO,4,Pública,1,Fecha corte REPS: Mar 15 2021 1:16PM
Bolívar,MAGANGUÉ,"1,343,000,179",EMPRESA SOCIAL DEL ESTADO RIO GRANDE DE LA MAGDALENA DEL MUNICIPIO DE MAGANGUE,,"806,013,598",EMPRESA SOCIAL DEL ESTADO RIO GRANDE DE LA MAGDALENA DEL MUNICIPIO DE MAGANGUE,1,Instituciones - IPS,SI,CALLE 14B 2 14 BARRIO CENTRO,3003623436- 3126047626,,interventor@eseriogrande.gov.co,WILFREY RUIZ BARRERA,1,MUNICIPAL,SI,"20,110,330","20,210,831",,2,JURIDICO,4,Pública,13,Fecha corte REPS: Mar 15 2021 1:16PM
Bolívar,MAGANGUÉ,"1,343,000,533",Fundación Centro Medico Para El Desarrollo Humano En Salud,,"806,008,828",Fundación Centro Medico Para El Desarrollo Humano En Salud,1,Instituciones - IPS,,CRR 4 12 C 118 BARRIO: CENTRO,3016055666,,cemdescentromedico@gmail.com,Jarle David Zuñiga Vega,,,SI,"20,201,014","20,241,013",,1,JURIDICO,1,Privada,1,Fecha corte REPS: Mar 15 2021 1:16PM
Bolívar,MAGANGUÉ,"1,343,000,936",Fundación Clínica San José del Caribe,,"901,238,058",FUNDACION CLINICA SAN JOSE DEL CARIBE,1,Instituciones - IPS,,Barrio san josé cll 16a N12-27,6888995,,fundacionsanjose_contratacion@outlook.com,LICETH CASTELLAR MARRUGO,,,SI,"20,200,701","20,210,831",,8,JURIDICO,1,Privada,1,Fecha corte REPS: Mar 15 2021 1:16PM
Bolívar,MAGANGUÉ,"1,343,000,843",fundacion estilo de vida saludable ESVIDA IPS,,"819,004,229",fundacion estilo de vida saludable ESVIDA IPS,1,Instituciones - IPS,,CALLE 16 Nº 13-139 LOCAL 123,3157052239,,lgarcia@esvidaips.org,SONIA LUCIA CASTELLANOS PEREZ,,,SI,"20,161,006","20,210,831",,9,JURIDICO,1,Privada,1,Fecha corte REPS: Mar 15 2021 1:16PM
Bolívar,MAGANGUÉ,"1,343,000,681",FUNDACION SISTEMAS INTEGRALES SIS,,"900,535,633",FUNDACION SISTEMAS INTEGRALES SIS,1,Instituciones - IPS,,CALLE 17 #10A-07 LOCAL 3 - Barrio:PUEBLO NUEVO,3012711978 - 3013645047,,nicoguerra2@gmail.com,YERYLIN PAOLA GUERRA BARRIOS,,,SI,"20,190,816","20,210,831",,3,JURIDICO,1,Privada,1,Fecha corte REPS: Mar 15 2021 1:16PM
Bolívar,MAGANGUÉ,"1,343,000,899",FUNDACIÓN SOCIAL PARA PROMOCIÓN DE VIDA,,"900,464,901",FUNDACION SOCIAL PARA PROMOCION DE VIDA,1,Instituciones - IPS,,BARRIO PUEBLO NUEVO CRA 11 #16-35,6888291: 6930917 - 6931586,"6,888,291",calidad@fundovidaips.com,LUZ ADRIANA VELEZ VASQUEZ,,,SI,"20,181,025","20,221,024",,7,JURIDICO,1,Privada,1,Fecha corte REPS: Mar 15 2021 1:16PM
Bolívar,MAGANGUÉ,"1,343,000,771",GRUPO VIDA MAGANGUE IPS S.A.S,,"900,775,106",GRUPO VIDA MAGANGUE IPS S.A.S,1,Instituciones - IPS,,CALLE 17 No 9-104 BARRIO OLAYA,300 3092341 - 6888287,,grupovida@gmail.com,GUSTAVO ADOLFO DUNCAN FONTALVO,,,SI,"20,150,407","20,210,831",,2,JURIDICO,1,Privada,1,Fecha corte REPS: Mar 15 2021 1:16PM
Bolívar,MAGANGUÉ,"1,343,000,751",Integral Home Care S.A.S - Magangue,,"900,540,946",INTEGRAL HOME CARE S.A.S.,1,Instituciones - IPS,,Calle 16 No 34 - 35 Piso 1 Local 114,3185169343,,integralhomecare@hotmail.es,JAILIN PAOLA CONTRERAS PALLARES,,,SI,"20,140,917","20,210,831",,3,JURIDICO,1,Privada,1,Fecha corte REPS: Mar 15 2021 1:16PM
Bolívar,MAGANGUÉ,"1,343,000,927",INTEGRALES HEALTH S.A.S,,"900,638,867",INTEGRALES HEALTH S.A.S,1,Instituciones - IPS,,"Barrio Olaya Herrera, Cra 13 #16-45",3215453690,,calidad@clinicadelosrios.com,ROSMERY DEL ROSARIO ELLES LORA,,,SI,"20,181,205","20,221,204",,2,JURIDICO,1,Privada,1,Fecha corte REPS: Mar 15 2021 1:16PM
Bolívar,MAGANGUÉ,"1,343,000,893",IPS DE LA COSTA SA,,"823,004,710",IPS DE LA COSTA S.A,1,Instituciones - IPS,,calle 15 No. 6-130 BARRIO CORDOBA,6888377 - 3105211088 - 3117585859,,Magangue@ipsdelacosta.co,JOSE HERNANDO DE LA HOZ LOMANTO,,,SI,"20,171,127","20,211,126",,5,JURIDICO,1,Privada,1,Fecha corte REPS: Mar 15 2021 1:16PM
Bolívar,MAGANGUÉ,"1,343,010,829",IPS MADRE NUESTRA SANTA SOFIA,,"900,948,888",IPS MADRE NUESTRA SANTA SOFIA,1,Instituciones - IPS,,Cll 11a N°3-70 Barrio Centro,3177379286,,ipsmadrenuestrasantasofia@gmail.com,YAMIL BHACHIR CURE AYALA,,,SI,"20,190,905","20,230,904",,7,JURIDICO,1,Privada,1,Fecha corte REPS: Mar 15 2021 1:16PM
Bolívar,MAGANGUÉ,"1,343,000,811",IPS NUEVO SER S.A.S,,"900,845,213",IPS NUEVO SER S.A.S,1,Instituciones - IPS,,Calle 16 N° 67-1237 Barrio Camilo Torres,3006004877,,nuevoserips@gmail.com,JANIO JAVIER MIRANDA RONCALLO,,,SI,"20,150,914","20,210,831",,3,JURIDICO,1,Privada,1,Fecha corte REPS: Mar 15 2021 1:16PM
Bolívar,MAGANGUÉ,"1,343,000,566",IPS VIDA INTEGRAL,,"802,023,689",Vida Integral limitada,1,Instituciones - IPS,,BARRIO PUEBLO NUEVO CAllE 16 CARRERA 11,6888044 - 3043487460 - 3007946710,"6,888,044",vidaintegralips@hotmail.com,FERMIN ALIRIO REYES FERNANDEZ,,,SI,"20,180,313","20,210,831",,2,JURIDICO,1,Privada,1,Fecha corte REPS: Mar 15 2021 1:16PM
Bolívar,MAGANGUÉ,"1,343,000,701",IPS VITAL SALUD S.A.S,,"900,217,580",IPS VITAL SALUD S.A.S,1,Instituciones - IPS,,Calle 15 No 6-45,3002943771,,ipsvitalsaludeu@gmail.com,Neisa Del Carmen Guerra Davila,,,SI,"20,121,206","20,210,831",,8,JURIDICO,1,Privada,1,Fecha corte REPS: Mar 15 2021 1:16PM
Bolívar,MAGANGUÉ,"1,343,001,485",JAIME GUERRERO CIRUGIA ORAL E IMPLANTOLOGIA,,"900,624,773",JAIME GUERRERO CIRUGIA ORAL E IMPLANTOLOGIA,1,Instituciones - IPS,,Calle 16 No. 9 - 121 Piso 1 Local 1,3015191880,,jaimeguerrerolopez@hotmail.com,JAIME ALFONSO GUERRERO LOPEZ,,,SI,"20,161,202","20,210,831",,8,JURIDICO,1,Privada,1,Fecha corte REPS: Mar 15 2021 1:16PM
Bolívar,MAGANGUÉ,"1,343,000,063",LABORATORIO CLÍNICO BACTERIOLÓGICO FLEMING DE MAGANGUÉ EU.,,"900,024,817",LABORATORIO CLÍNICO BACTERIOLÓGICO FLEMING DE MAGANGUÉ EU.,1,Instituciones - IPS,,CALLE 17 # 6A-79,6878949 - 3175030491,"6,878,949",labflemingmagangué@gmail.com,JACQUELINE DEL CARMEN VILLA ECHENIQUE,,,SI,"20,110,408","20,210,831",,9,JURIDICO,1,Privada,1,Fecha corte REPS: Mar 15 2021 1:16PM
Bolívar,MAGANGUÉ,"1,343,000,746",O2 VITAL S.A.S,,"900,709,216",O2VITAL S.A.S,1,Instituciones - IPS,,Calle 17 N° 9-05 BARR PUEBLO NUEVO,3215377641 - 3014488077,,o2vital.s.a.s@gmail.com,JORGE ENRRIQUE CASTRO VILLEGAS,,,SI,"20,140,927","20,210,831",,3,JURIDICO,1,Privada,1,Fecha corte REPS: Mar 15 2021 1:16PM
Bolívar,MAGANGUÉ,"1,343,000,775",OFTALMOLOGOS ASOCIADOS DE LA COSTA SAS,,"823,002,800",OFTALMOLOGOS ASOCIADOS DE LA COSTA SAS,1,Instituciones - IPS,,Cra 14 n 3-48 piso 1,3107315890,,oftalmocosta@yahoo.es,JOSE IGNACIO RESTOM MERLANO,,,SI,"20,141,111","20,210,831",,0,JURIDICO,1,Privada,1,Fecha corte REPS: Mar 15 2021 1:16PM
Bolívar,MAGANGUÉ,"1,343,000,469",optica cristal magangue ltda,,"900,118,485",optica cristal magangue ltda,1,Instituciones - IPS,,CRA 2 Nº 11-24 CLLE EL SALTO,6878038,,opticacristalmagangue@hotmail.com,YINA SOFIA BERTEL LAMBRAÑO,,,SI,"20,150,410","20,210,831",,1,JURIDICO,1,Privada,1,Fecha corte REPS: Mar 15 2021 1:16PM
Bolívar,MAGANGUÉ,"1,343,000,946",PROJECT SALUD BCH SAS,,"901,324,001",PROJECT SALUD BCH SAS,1,Instituciones - IPS,,PORTALES SAN FERNANDO TORRE 1 APT 368,3106216392,,chavezglaborando@hotmail.com,KEVIN JOSE ARTEAGA SUAREZ,,,SI,"20,200,724","20,240,723",,7,JURIDICO,1,Privada,1,Fecha corte REPS: Mar 15 2021 1:16PM
Bolívar,MAGANGUÉ,"1,343,000,915",PROMOTORES DE LA SALUD S.A.S,,"802,011,610",PROMOTORES DE LA SALUD DE LA COSTA S.A.S,1,Instituciones - IPS,,CARRERA 3 No. 9-15,3107157863 3105628452,"3,104,703,219",calidadpromocosta@gmail.com,ANGELICA MARIA CONQUETT LORA,,,SI,"20,180,814","20,220,813",,1,JURIDICO,1,Privada,1,Fecha corte REPS: Mar 15 2021 1:16PM
Bolívar,MAGANGUÉ,"1,343,000,010",PROSALUD IPS SAS,,"806,007,258",PROSALUD IPS SAS,1,Instituciones - IPS,,TRANSVERSAL 4° # 13-118 BARR CENTRO,6888111 - 3017544232 - 3225694112,"6,888,111",anuardavid@hotmail.com,NELLIS ELENA MANJARRES RODRIGUEZ,,,SI,"20,151,229","20,210,831",,9,JURIDICO,1,Privada,1,Fecha corte REPS: Mar 15 2021 1:16PM
Bolívar,MAGANGUÉ,"1,343,000,518",SALUD EN CASA MAGANGUE I.P.S. LTDA,,"900,210,305",SALUD EN CASA MAGANGUE I.P.S. LTDA,1,Instituciones - IPS,,CALLE 17 N° 8-19 - Barrio:CORDOBA,3013709073,,tulialarcon@yahoo.es,GERTRUDIS ALARCON AVILA,,,SI,"20,160,810","20,210,831",,7,JURIDICO,1,Privada,3,Fecha corte REPS: Mar 15 2021 1:16PM
Bolívar,MAGANGUÉ,"1,343,000,898",SERVICIOS FONOAUDIOLOGICOS INTEGRALES DE LA COSTA S.A.S,,"901,152,138",SERVICIOS FONOAUDIOLOGICOS INTEGRALES DE LA COSTA S.A.S,1,Instituciones - IPS,,AVENIDA SAN JOSE CALLE 16A - 4,3502152784,,servifonodelacosta@gmail.com,GERTRUDIS PADILLA ESCOBAR,,,SI,"20,180,625","20,220,624",,8,JURIDICO,1,Privada,1,Fecha corte REPS: Mar 15 2021 1:16PM
Bolívar,MAGANGUÉ,"1,343,002,908",SERVICIOS MEDICOS OLIMPUS IPS S.A.S,,"800,033,723",SERVICIOS MEDICOS OLIMPUS I.P.S. SOCIEDAD POR ACCIONES SIMPLIFICADA,1,Instituciones - IPS,,calle 16 # 10a-143,3187117423,,calidad@olimpuslab.com,BEATRIZ MERCEDES ESPINOSA DE CASTRO,,,SI,"20,170,614","20,210,831",,0,JURIDICO,1,Privada,1,Fecha corte REPS: Mar 15 2021 1:16PM
Bolívar,MAGANGUÉ,"1,343,000,603",UNIDAD DE CUIDADOS INTENSIVOS NEONATALES DE MAGANGUE SAS,,"900,378,914",UNIDAD DE CUIDADOS INTENSIVOS NEONATALES DE MAGANGUE SAS,1,Instituciones - IPS,,CARRERA 16 #16b - 257,6875591,"6,875,591",ucinmag@hotmail.com,NICOLAS EDUARDO MARTINEZ MERCADO,,,SI,"20,160,216","20,210,831",,4,JURIDICO,1,Privada,1,Fecha corte REPS: Mar 15 2021 1:16PM
Bolívar,MAGANGUÉ,"1,343,000,541",UNIDAD DE IMAGENOLOGIA LA CANDELARIA S.A.S.,,"900,263,064",UNIDAD DE IMAGENOLOGIA LA CANDELARIA S.A.S.,1,Instituciones - IPS,NO,KARRERA 3A No 14-36,3108909373 - 3215641587,,uicsas2020@gmail.com,LUIS RAMON VARGAS ROJAS,,,SI,"20,090,206","20,210,831",,4,JURIDICO,1,Privada,1,Fecha corte REPS: Mar 15 2021 1:16PM
Bolívar,MAGANGUÉ,"1,343,000,606",UNIDAD MEDICA MOVIL LA CANDELARIA LTDA,,"900,377,997",UNIDAD MEDICA MOVIL LA CANDELARIA LTDA,1,Instituciones - IPS,,CRA 10D#16-35 BARRIO CORDOBA,3175008100 3215008100 3005008100,,ummcande@gmail.com,HUMBERTO ENRIQUE LOPEZ PUENTE,,,SI,"20,150,324","20,210,831",,0,JURIDICO,1,Privada,1,Fecha corte REPS: Mar 15 2021 1:16PM
Bolívar,MAGANGUÉ,"1,343,000,683",Vital Caribe SAS,,"900,827,631",Vital Caribe SAS,1,Instituciones - IPS,,Carrera 14 N° 16 -42,3012814238,,asisvitalcaribe@gmail.com,Alberto Gregorio Lora Pedroza,,,SI,"20,150,903","20,210,831",,2,JURIDICO,1,Privada,1,Fecha corte REPS: Mar 15 2021 1:16PM
Bolívar,MAHATES,"1,343,300,951",CAMINOS IPS S.A.S,,"901,111,348",CAMINOS IPS S.A.S,1,Instituciones - IPS,,BARRIO SANTANDER CRA 43 13-36,3206043045,,info@caminosips.com,Martha Matilde Castaño Vergara,,,SI,"20,201,005","20,241,004",,2,JURIDICO,1,Privada,1,Fecha corte REPS: Mar 15 2021 1:16PM
Bolívar,MAHATES,"1,343,300,598",centro medico integral altos de la candelaria s.a.s,,"900,351,827",centro medico integral altos de la candelaria s.a.s,1,Instituciones - IPS,,CARRERA 32A 19-35 BRR LAVERA,6422378,"6,422,378",ips-altosdelacandelaria@hotmail.com,VALERIA SOLANO CORONEL,,,SI,"20,160,721","20,210,831",,4,JURIDICO,1,Privada,1,Fecha corte REPS: Mar 15 2021 1:16PM
Bolívar,MAHATES,"1,343,300,100",E.S.E. HOSPITAL LOCAL MAHATES,,"806,007,880",E.S.E. HOSPITAL LOCAL MAHATES,1,Instituciones - IPS,SI,CALLE 18 # 41 -10 SANTANDER,3114292424-3205446997,,hlmahates@outlook.com,NILSON JOSÉ CORONEL CANTILLO,1,MUNICIPAL,SI,"20,160,825","20,210,831",,0,JURIDICO,4,Pública,1,Fecha corte REPS: Mar 15 2021 1:16PM
Bolívar,MAHATES,"1,343,300,830",medicenter su salud ips SAS,,"900,810,776",medicenter su salud ips SAS,1,Instituciones - IPS,,KR 32A CL 19-57,3002242747,,medicentersusalusips@gmail.com,KAREN AMALIA MARTINEZ OSORIO,,,SI,"20,160,901","20,210,831",,7,JURIDICO,1,Privada,1,Fecha corte REPS: Mar 15 2021 1:16PM
Bolívar,MARÍA LA BAJA,"1,344,200,163",HOSPITAL LOCAL MARIA LA BAJA ESE,,"806,010,788",E.S.E. HOSPITAL LOCAL MARIALABAJA,1,Instituciones - IPS,SI,Calle 20 Nº 8 78,3145504318-3164457522,,cadelia22@hotmail.com,Carmen Delia Avila Dulcey,1,MUNICIPAL,SI,"20,030,408","20,210,831",,1,JURIDICO,4,Pública,1,Fecha corte REPS: Mar 15 2021 1:16PM
Bolívar,MARÍA LA BAJA,"1,344,200,334",IPS JOSE MARIA TORRES BELTRAN LTDA,,"806,009,229",IPS JOS MARIA TORRES BELTRAN LTDA,1,Instituciones - IPS,,CRA 15 No. 21-17,"3046767613, 3005566261","3,046,767,613",sergioggarcia2011@gmail.com ipsjmtbdfuentes@gmail.com,DALILA ESTELA FUENTES TORRES,,,SI,"20,190,507","20,210,831",,4,JURIDICO,1,Privada,1,Fecha corte REPS: Mar 15 2021 1:16PM
Bolívar,MARÍA LA BAJA,"1,344,200,823",IPS MEDICOS DE CORAZON S.A.S,,"900,900,513",IPS MEDICOS DE CORAZON S.A.S,1,Instituciones - IPS,,RAICERO CL 18-11-17,3106053913,,ipsdrjosepalacin@gmail.com,PETRONA RAMOS GONZALEZ,,,SI,"20,161,005","20,210,831",,3,JURIDICO,1,Privada,1,Fecha corte REPS: Mar 15 2021 1:16PM
Bolívar,MARÍA LA BAJA,"1,344,200,944",IPS MERCED SALUD SAS,,"901,243,544",IPS MERCED SALUD SAS,1,Instituciones - IPS,,Carrera 14 N 36 195 barrio el puerto,3002453323,,Mercedita19_22@hotmail.com,amalia de las mercedes lora marrugo,,,SI,"20,190,530","20,230,529",,6,JURIDICO,1,Privada,1,Fecha corte REPS: Mar 15 2021 1:16PM
Bolívar,MARÍA LA BAJA,"1,344,200,448",MEIN SALUD IPS LTDA,,"900,093,615",MEIN SALUD I.P.S LTDA,1,Instituciones - IPS,,CARRERA 15 1J-170 BARRIO MONTE CARLOS,6260178 3147788536 3147790042,"6,260,178",meinsalud2006@hotmail.com,ANTONIA ZARABIA BARRIOS,,,SI,"20,170,308","20,210,831",,2,JURIDICO,1,Privada,1,Fecha corte REPS: Mar 15 2021 1:16PM
Bolívar,MARÍA LA BAJA,"1,344,200,191",UNIDAD MEDICA INMACULADA CONCEPCION LTDA,,"806,010,400",UNIDAD MEDICA INMACULADA CONCEPCION LTDA,1,Instituciones - IPS,,LA CALLE 9 CARRERA 14-29,6262031,,inmafel@hotmail.com,FELIPE SANTIAGO TORRES RAMOS,,,SI,"20,160,418","20,210,831",,1,JURIDICO,1,Privada,1,Fecha corte REPS: Mar 15 2021 1:16PM
Bolívar,MOMPÓS,"1,346,800,842",AMEPS SAS,,"900,975,389",AMEPS SAS,1,Instituciones - IPS,,CRA 1 30 10 corregimiento GUATACA,3122372338,,amepssas@gmail.com,MELQUICEDEC CORDOBA MARCHAN,,,SI,"20,160,825","20,210,831",,8,JURIDICO,1,Privada,1,Fecha corte REPS: Mar 15 2021 1:16PM
Bolívar,MOMPÓS,"1,346,800,039",APROSALUD LTDA,,"806,000,070",APROSALUD LTDA,1,Instituciones - IPS,,KARRERA 1°A # 12-49 B.ARRIBA - Barrio:ARRIBA,3107073984 - 3106857595,,aprosaludips@yahoo.es,RAMIRO RODRIGUEZ ALEMAN,,,SI,"20,110,510","20,210,831",,1,JURIDICO,1,Privada,6,Fecha corte REPS: Mar 15 2021 1:16PM
Bolívar,MOMPÓS,"1,346,800,862",centro especializado en medicina del sueño y del corazon sas,,"900,815,727",centro especializado en medicina del sueno y del corazon,1,Instituciones - IPS,,cr 2 # 21-140 consultorio 3 y 9,3226530585,"6,888,299",mercedes.alarconsanchez@gmail.com,MERCEDES ALARCON SANCHEZ,,,SI,"20,170,406","20,210,831",,9,JURIDICO,1,Privada,2,Fecha corte REPS: Mar 15 2021 1:16PM
Bolívar,MOMPÓS,"1,346,800,078",ESE HOSPITAL LOCAL SANTA MARIA,,"806,007,257",E.S.E. HOSPITAL LOCAL SANTA MARIA DE MOMPOX BOLIVAR,1,Instituciones - IPS,SI,CRA 3 No. 24 - 01,3145246170 - 3004701030,,gerencia@esesantamariamompox.gov.co,VICTOR JULIO SERRANO RUBIO,1,MUNICIPAL,SI,"20,030,325","20,210,831",,1,JURIDICO,4,Pública,1,Fecha corte REPS: Mar 15 2021 1:16PM
Bolívar,MOMPÓS,"1,346,800,722",FUNDACION REHABILITAR ES AMAR,,"900,628,594",FUNDACION REHABILITAR ES AMAR,1,Instituciones - IPS,,Carrera 1° # 12-11 FRENTE AL BOSQUE SANTANDER,3016238015 - 3205683539,,fundacionrehabilitar@outlook.com,VIVIANA PATRICIA DE LAS SALAS ROMERO,,,SI,"20,160,428","20,210,831",,4,JURIDICO,1,Privada,1,Fecha corte REPS: Mar 15 2021 1:16PM
Bolívar,MOMPÓS,"1,346,800,339",FUNDACION SER IPS MOMPOX,,"806,012,960",FUNDACION SER,1,Instituciones - IPS,,Calle Real del Medio Carrera 2a No 15-95,6865694,,gerentegeneral@fundaser.co,NELLY BELEN ARSUZA MENDOZA,,,SI,"20,181,012","20,221,011",,1,JURIDICO,1,Privada,1,Fecha corte REPS: Mar 15 2021 1:16PM
Bolívar,MOMPÓS,"1,346,801,001",IPS NUEVO HORIZONTE MOMPOX,,"900,916,297",IPS NUEVO HORIZONTE MOMPOX,1,Instituciones - IPS,,CRA 2DA No 20-90,6855908 - 3116650333,,ipsnuevohorizontemonpox@gmail.com,LUISA MARIA PEREZ MARTINEZ,,,SI,"20,160,204","20,210,831",,7,JURIDICO,1,Privada,1,Fecha corte REPS: Mar 15 2021 1:16PM
Bolívar,MOMPÓS,"1,346,800,661",IPS SANFRANCISCO DE MOMPOS LTDA,,"900,494,165",IPS SANFRANCISCO DE MOMPOS LTDA,1,Instituciones - IPS,,CARRERA 2° # 19-96 P1 AP2,3202490617 - 3135163669,,ipssanfrancisco@gmail.com,RAFAEL HENRIQUE TRONCOSO GARCIA,,,SI,"20,120,131","20,210,831",,0,JURIDICO,1,Privada,1,Fecha corte REPS: Mar 15 2021 1:16PM
Bolívar,MOMPÓS,"1,346,800,983",NACER MOMPOX IPS SAS,,"900,797,596",NACER MOMPOX IPS SAS,1,Instituciones - IPS,,CARRERA 1 Nº 7 -81,6855144-3215391619-310608375,,nacerips@yahoo.com,EDIT CECILIA OSPINO FONSECA,,,SI,"20,190,204","20,230,203",,2,JURIDICO,1,Privada,1,Fecha corte REPS: Mar 15 2021 1:16PM
Bolívar,MOMPÓS,"1,346,800,795",PERSISTIR IPS,,"900,831,948",PERSISTIR IPS,1,Instituciones - IPS,,CARRERA 1° CALLE 12-35 BRR ALVARRADA,3205522411 - 3145881858,,ritaricorodriguez@hotmail.com,VARGAS WUILFRIDO PEÑA,,,SI,"20,150,408","20,210,831",,7,JURIDICO,1,Privada,1,Fecha corte REPS: Mar 15 2021 1:16PM
Bolívar,MOMPÓS,"1,346,800,533",SALUD PARA TI IPS S.A.S.,,"901,382,294",SALUD PARA TI IPS S.A.S.,1,Instituciones - IPS,,CARRERA 1 No 30 - 10 CORREGIMIENTO GUATACA,3106336834,"3,106,336,834",saludparatiips@gmail.com,PABLO CESAR PABA RIOS,,,SI,"20,200,909","20,240,908",,5,JURIDICO,1,Privada,1,Fecha corte REPS: Mar 15 2021 1:16PM
Bolívar,MONTECRISTO,"1,345,800,222",ESE CENTRO DE SALUD CON CAMAS DE MONTECRISTO,,"806,008,930",ESE CENTRO DE SALUD CON CAMAS DE MONTECRISTO,1,Instituciones - IPS,SI,CALLE PRINCIPAL SECTOR CENTRAL,3145765223 - 3157839809,,esemontecristobolivar@gmail.com - yanimendezg@hotmail.com,YANIRIS MENDEZ GALVIS,1,MUNICIPAL,SI,"20,110,330","20,210,831",,5,JURIDICO,4,Pública,1,Fecha corte REPS: Mar 15 2021 1:16PM
Bolívar,MORALES,"1,347,300,231",ese hospital san sebastian,,"806,007,002",ese hospital san sebastian,1,Instituciones - IPS,SI,KM 1 VIA A PUERTO BOLIVAR,3114162680,,hospitalsansebastianmoralesbol@gmail.com,LUIS FERNANDO GALEZO JALKH,1,MUNICIPAL,SI,"20,150,324","20,210,831",,0,JURIDICO,4,Pública,14,Fecha corte REPS: Mar 15 2021 1:16PM
